{
  "oab_version": "0.1.0",
  "generated": "2026-08-09",
  "target": {
    "repository": "example/shop",
    "commit": "a1b2c3d",
    "scope": "full"
  },
  "context": {
    "stage": "2",
    "peak_rps": 30,
    "users": 12000,
    "team_size": 6,
    "availability_target": null,
    "budget": null,
    "assumptions": [
      {
        "text": "Peak traffic around 30 RPS, inferred from a 6-person team and 12k users with no analytics configuration present",
        "confidence": "low"
      },
      {
        "text": "No formal availability target exists; none is stated in the repository",
        "confidence": "medium"
      }
    ]
  },
  "repo_facts": {
    "languages": [
      {
        "name": "Ruby",
        "version": "3.2",
        "share": 0.86
      },
      {
        "name": "JavaScript",
        "share": 0.11
      }
    ],
    "frameworks": [
      "Rails 7.0"
    ],
    "architecture_style": "single-deployable",
    "deployables": [
      {
        "name": "web",
        "kind": "web",
        "path": "."
      },
      {
        "name": "worker",
        "kind": "worker",
        "path": "."
      }
    ],
    "datastores": [
      {
        "kind": "relational",
        "product": "PostgreSQL",
        "managed": null,
        "evidence": [
          "config/database.yml:3",
          "Gemfile:14"
        ]
      }
    ],
    "caches": [],
    "queues": [
      {
        "product": "Sidekiq",
        "kind": "queue",
        "managed": false,
        "evidence": [
          "Gemfile:22",
          "config/sidekiq.yml:1"
        ]
      }
    ],
    "external_services": [
      {
        "name": "Stripe",
        "category": "payments",
        "in_request_path": true,
        "has_timeout": false,
        "evidence": [
          "app/services/checkout.rb:88",
          "Gemfile:41"
        ]
      }
    ],
    "deployment": {
      "containerised": true,
      "orchestration": "none",
      "iac": [],
      "ci": [
        "GitHub Actions"
      ],
      "environments": [
        "production",
        "staging"
      ],
      "evidence": [
        "Dockerfile:1",
        ".github/workflows/deploy.yml:1"
      ]
    },
    "background_work": [
      {
        "name": "nightly digest",
        "kind": "cron",
        "evidence": [
          "config/schedule.rb:12"
        ]
      }
    ],
    "testing": {
      "frameworks": [
        "RSpec"
      ],
      "test_file_count": 214,
      "source_file_count": 631,
      "has_integration_tests": true
    },
    "migrations": {
      "tool": "ActiveRecord",
      "count": 87,
      "evidence": [
        "db/migrate/"
      ]
    },
    "observability": {
      "structured_logging": false,
      "metrics": false,
      "tracing": false,
      "error_tracking": true,
      "correlation_ids": false,
      "health_checks": true,
      "evidence": [
        "Gemfile:55",
        "config/routes.rb:9"
      ]
    },
    "configuration": {
      "secrets_in_env": true,
      "secrets_committed": false,
      "config_files": [
        "config/application.rb",
        ".env.example"
      ]
    },
    "repository": {
      "file_count": 1284,
      "commit_count": 3401,
      "first_commit": "2024-03-11",
      "last_commit": "2026-08-01",
      "contributors": 6
    },
    "undetermined": [
      "Actual production traffic \u2014 no analytics configuration found in the repository",
      "Whether the database is managed or self-hosted \u2014 no infrastructure-as-code present"
    ]
  },
  "findings": [
    {
      "id": "F-003",
      "severity": "HIGH",
      "title": "Payment provider called synchronously in the request path with no timeout",
      "evidence": [
        "app/services/checkout.rb:88",
        "Gemfile:41"
      ],
      "context": "Checkout is the primary revenue path; roughly 30 RPS peak; no circuit breaker present",
      "impact": "Provider latency propagates directly to users. A provider stall exhausts the web worker pool and takes down all endpoints, not just checkout.",
      "remedy": "Set an explicit client timeout (2 s connect, 5 s read) and isolate the call behind a bulkhead so provider degradation cannot consume the whole pool",
      "effort": "S",
      "knowledge": [
        "timeouts",
        "bulkheads",
        "circuit-breakers"
      ],
      "trigger": "Revisit for asynchronous processing when checkout p95 exceeds 800 ms or provider error rate exceeds 1% over 1 hour",
      "scale_independent": true
    }
  ],
  "summary": {
    "verdict": "The architecture is appropriate for its scale. The findings concern failure isolation and observability, not scale \u2014 a single database instance is correct here and is not reported as a problem.",
    "counts": {
      "CRITICAL": 0,
      "HIGH": 1,
      "MEDIUM": 2,
      "LOW": 1,
      "INFORMATIONAL": 3
    },
    "complexity": {
      "available": 10,
      "spent": 5
    }
  }
}
